{
  "authority_scope": "supplied-repository-metadata-observation",
  "catalog_identity_sha256": "7bc569476058987386b096336256eef08eb4f2ac56d6c693c02cdb8ee7e933d6",
  "catalog_type": "observed-hosting-repository-catalog",
  "limitations": [
    "catalog_is_a_supplied_point_in_time_observation",
    "catalog_does_not_prove_repository_ownership_or_administration",
    "catalog_does_not_prove_branch_protection_or_push_acceptance",
    "catalog_does_not_approve_target_mapping_or_source_removal",
    "catalog_does_not_assert_scientific_truth"
  ],
  "observed_at_utc": "2026-07-20T01:31:38Z",
  "organization": "Sounio-lang",
  "repositories": [
    {
      "archived": false,
      "default_branch": "main",
      "head_oid": "ab5336faddf77f2e4bb3be01dfa3c1567ea9761e",
      "is_empty": false,
      "name_with_owner": "Sounio-lang/affective-geometry",
      "observed_permission": "ADMIN",
      "remote_url": "https://github.com/Sounio-lang/affective-geometry.git",
      "repository_id": "affective-geometry",
      "visibility": "PRIVATE"
    },
    {
      "archived": false,
      "default_branch": "main",
      "head_oid": "a556aac970e682956baec58c91da8ad1f4de1de9",
      "is_empty": false,
      "name_with_owner": "Sounio-lang/darwin-pbpk",
      "observed_permission": "ADMIN",
      "remote_url": "https://github.com/Sounio-lang/darwin-pbpk.git",
      "repository_id": "darwin-pbpk",
      "visibility": "PUBLIC"
    },
    {
      "archived": false,
      "default_branch": "main",
      "head_oid": "3e7d49fb84c7b8c74b8fd4b1cc39660772d9c7d1",
      "is_empty": false,
      "name_with_owner": "Sounio-lang/epistemic-core",
      "observed_permission": "ADMIN",
      "remote_url": "https://github.com/Sounio-lang/epistemic-core.git",
      "repository_id": "epistemic-core",
      "visibility": "PUBLIC"
    },
    {
      "archived": false,
      "default_branch": "main",
      "head_oid": "5cf8be05b96c0a5c2ab101e022b36019dd61ebef",
      "is_empty": false,
      "name_with_owner": "Sounio-lang/sounio",
      "observed_permission": "ADMIN",
      "remote_url": "https://github.com/Sounio-lang/sounio.git",
      "repository_id": "sounio",
      "visibility": "PUBLIC"
    },
    {
      "archived": false,
      "default_branch": "main",
      "head_oid": "bdc8a03e96602aa6c901246fbe38c652e626261f",
      "is_empty": false,
      "name_with_owner": "Sounio-lang/sounio-benchmarks",
      "observed_permission": "ADMIN",
      "remote_url": "https://github.com/Sounio-lang/sounio-benchmarks.git",
      "repository_id": "sounio-benchmarks",
      "visibility": "PUBLIC"
    },
    {
      "archived": false,
      "default_branch": "main",
      "head_oid": "a22f66e0060ba6d007b8b69012ecadee7e9345bd",
      "is_empty": false,
      "name_with_owner": "Sounio-lang/sounio-examples",
      "observed_permission": "ADMIN",
      "remote_url": "https://github.com/Sounio-lang/sounio-examples.git",
      "repository_id": "sounio-examples",
      "visibility": "PUBLIC"
    },
    {
      "archived": false,
      "default_branch": "main",
      "head_oid": "c412c0d1e7ef276d3ad9d1e662d681369e3e384c",
      "is_empty": false,
      "name_with_owner": "Sounio-lang/sounio-formats",
      "observed_permission": "ADMIN",
      "remote_url": "https://github.com/Sounio-lang/sounio-formats.git",
      "repository_id": "sounio-formats",
      "visibility": "PUBLIC"
    },
    {
      "archived": false,
      "default_branch": "main",
      "head_oid": "bd5784d40f2174efa5ffe752f1a27ce9ff9e6473",
      "is_empty": false,
      "name_with_owner": "Sounio-lang/sounio-grammar",
      "observed_permission": "ADMIN",
      "remote_url": "https://github.com/Sounio-lang/sounio-grammar.git",
      "repository_id": "sounio-grammar",
      "visibility": "PUBLIC"
    },
    {
      "archived": false,
      "default_branch": "main",
      "head_oid": "ca0eb85af769e26bf632ebaafc9e81f9f7b86335",
      "is_empty": false,
      "name_with_owner": "Sounio-lang/sounio-hardware",
      "observed_permission": "ADMIN",
      "remote_url": "https://github.com/Sounio-lang/sounio-hardware.git",
      "repository_id": "sounio-hardware",
      "visibility": "PUBLIC"
    },
    {
      "archived": false,
      "default_branch": "main",
      "head_oid": "8e593615072e7ad9962ab27c0e316a8be521457d",
      "is_empty": false,
      "name_with_owner": "Sounio-lang/sounio-io-primitives",
      "observed_permission": "ADMIN",
      "remote_url": "https://github.com/Sounio-lang/sounio-io-primitives.git",
      "repository_id": "sounio-io-primitives",
      "visibility": "PUBLIC"
    },
    {
      "archived": false,
      "default_branch": "main",
      "head_oid": "123ea9906502545947757ec61b55b473e8b4f58d",
      "is_empty": false,
      "name_with_owner": "Sounio-lang/sounio-llm-training",
      "observed_permission": "ADMIN",
      "remote_url": "https://github.com/Sounio-lang/sounio-llm-training.git",
      "repository_id": "sounio-llm-training",
      "visibility": "PUBLIC"
    },
    {
      "archived": false,
      "default_branch": "master",
      "head_oid": "44bc17e7b7f8c1a3577041538a7a4d0644dd89ee",
      "is_empty": false,
      "name_with_owner": "Sounio-lang/sounio-psychiatry",
      "observed_permission": "ADMIN",
      "remote_url": "https://github.com/Sounio-lang/sounio-psychiatry.git",
      "repository_id": "sounio-psychiatry",
      "visibility": "PUBLIC"
    },
    {
      "archived": false,
      "default_branch": "main",
      "head_oid": "7702ecef494f04e8b29457f338dfb3ebeadd0806",
      "is_empty": false,
      "name_with_owner": "Sounio-lang/sounio-py",
      "observed_permission": "ADMIN",
      "remote_url": "https://github.com/Sounio-lang/sounio-py.git",
      "repository_id": "sounio-py",
      "visibility": "PUBLIC"
    },
    {
      "archived": false,
      "default_branch": "main",
      "head_oid": "229d310f676d2a3a1e183983764da2ddd63f6fe0",
      "is_empty": false,
      "name_with_owner": "Sounio-lang/sounio-units",
      "observed_permission": "ADMIN",
      "remote_url": "https://github.com/Sounio-lang/sounio-units.git",
      "repository_id": "sounio-units",
      "visibility": "PUBLIC"
    }
  ],
  "schema": "sounio.physical-extraction-canonical-production-repository-catalog.v1"
}
